company_profile,description,requirements,benefits,fake
proficio mortgage is a rapidly growing mortgage lender that cares,who are weproficio mortgage is a rapidly growing mortgage lender,demonstrate the ability to represent the company in a professional,hourly pay full time hours per week no weekends fun,0
we are netguru and we love to develop web application,we are netguru and we love to develop web applications,great junior hr marketing manager is a person who knows,perks amp benefitscofinancing international conferencesenglish lessons once a weekhalfprice lunchesfifa xbox amp other,0
actioniq is a stealth startup building the next generation of,you are passionate about the convergence of breakthrough technology with,bs in computer science or similar msphd a plus  years,become a significant stakeholder of actioniq as part of your,0
finally picture this in charleston is the first dealership marketing,our company is growing rapidly start as a field tech,applicant must have an acceptable driving history and valid drivers,field tech assistants are paid roughly hr depends on individual,0
hello worldtalents drives the change in digital recruitment and develops,we are the most efficient and motivating way to become,strong communication skillshands on approach with focus on execution a,high impact and responsibility in a very successful and fast,0
bradley contracting group corporation offers a wide range of bb,were hiring for  design specialists web developers technical solutions implementor and technical,design specialistswork with clients to develop design presenceplans site design,the current standard company health life disability vision and dental insurance coverage,1
outstanding member service starts with outstanding peopleif you are committed,would you like to work for a trusted organization that,minimum of year experience working in a sales culture credit,our people are our most valuable asset we recognize their,0
missiongoldleaf homecare is revolutionizing home care by making our carepartners,descriptionabout the company amp the opportunitywe take great care of,required qualification years of proven pcp experience with testimonialsreferences years,we provide competitive rates for pcps per hour amp this can,0
we place highly qualified governors governesses nannies and private tutors,a russian school in the south of moscow are looking,all applicants should be currently living in moscow all applicants,the working hours would be monfri can provide visa assistance,0
were a fort worth based startup trying to change the,were a fort worth based startup trying to change the,youve got  years of technology or healthcare related marketing experiencestrong,and for your efforts we happily provide a competitive fulltime salary,0
zaius is a digital intuition platform enabling companies to optimize,zaius is a startup building a saas product to give,we are looking for talented engineers who meet qualifications similar,competitive salaryemployee stock option planhealth dental visionklife and disability insurancepto,0
everyone has a story to tell everyone is unique everyone,collaborate with the product and marketing teams to develop marketing,required experienceba or bs with focus on communication marketing journalism,competitive salary commensurate with skills and work experience company stock incentive,0
our passion for improving quality of life through geography is,the company esri environmental systems research instituteour passion for improving,education bachelors or masters in gis business administration or a related,our culture is anything but corporatewe have a collaborative creative,0
the amani institute is about developing whole individuals who have,this unique fieldbased fulltime program brings together individuals from different,what do we look for in a program participantif you,sign up for classmates from around the worldfacilitated apprenticeship placementdeveloping,0
at lendinvest fundamentally changing the way people think about their,urlfcbbdfaafedffbcedfeddbbfbeaff is a fastgrowing startup within the financial industryif youre,responsibilitiesmanual and automation testing end to endbuilding an automation framework,hackathonslots of greenfield projectsopportunity to attend conferencesseminars to expand your,0
everyone has a story to tell everyone is unique everyone,closely work with other members of the product team to,required experienceminimum year of experience as a web designerrequired technical,competitive salary commensurate with skills and work experiencecompany stock incentive,0
urlddbfaeecfaccfbffccfbbafacbefbee and aptitude staffing solutions have partnered up in an,qualified candidates are encouraged to apply directly to this job,position requirements quickly learning new areas being able to read scientific,our core values drive our culture this is what we,1
abc supply co inc is the nations largest wholesale distributor,as a sales representative you will provide assistance to our,as a sales representative you must have the ability to,your benefits package as a sales representative may includehealth dental,0
nfp is a leader in the delivery of benefits solutions,nfp hr services part of national financial partners is leading,candidates must have excellentattention to detail and commitment to outstanding,we offer a winning culture having been awarded the philadelphia,0
were an emerging technology agency and we build breakthrough products,you love clients and getting to be a conduit for,we want you if you have years of interactive visual,why work for mutual mobile we craft beautiful mobile interfaces,0
we are a family run business that has been in,bill dube hyundai in wilmington ma just outside of boston,come grow with our exploding internet sales deptartment  be part,compensation per hour plus commision commission is typically to per,0
crest financial is one of the leading privately held consumer,crest financial is a fun energetic successful established finance and,high school diploma or general education degree gedone to three,medicaldental benefits for full time employeescommissionspaid holidaysopportunity for growthraisesmonthly incentivesbonuses,0
hello worldtalents drives the change in digital recruitment and develops,we are a fastgrowing venturecapital financed company with offices in,years of handson product management experience mobile appstravel hospitality industry,launch product featuresbreak down product vision into product strategy and,0
aker solutions is a global provider of products systems and,corporate overviewaker solutions is a global provider of products systems,qualifications amp personal attributes degree in mechanical engineering other qualifications,we offer friendly colleagues in an industry with a bright,1
everyone has a story to tell everyone is unique everyone,closely work with other members of the product team to,required experienceminimum years of experience as a web designer working,competitive salary commensurate with skills and work experience company stock incentive,0
upstreams mission is to revolutionise the way companies market to,the position reports to the head of engagement management in,requirementsthe ideal candidate will be bright ambitious selfdriven hardworking and,salary amp benefitsthe opportunity to learn and grow in a,0
netgear and aptitude staffing solutions have partnered up in an,senior system test engineer san jose caas a member of,skills and requirementsbs in computer science or engineering  years in,broad responsibility autonomy and visibility in an engineering roleindepth exposure,1
upstreams mission is to revolutionise the way companies market to,the position reports to the head of engagement management in,requirementsdegree in technology engineering or marketing years of work experience,the opportunity to learn and grow in a worldclass business,0
our passion for improving quality of life through geography is,the company esri environmental systems research instituteour passion for improving,education bachelors or masters in gis business administration or a related,our culture is anything but corporatewe have a collaborative creative,0
smart search delivers executive search solutions tailored for global organizations,our client is a global advertising and marketing communications services,the senior client service manager will report to the organizations,this is an extremely rare opportunity for the right candidate,0
the accion  story began more than years ago in the,the center manager must establish and maintain excellent customer service,high school graduate ged or equivalent training and experienceknowledge of,social security tax saver program section flexible spending account deferred,1
one zero capital is an investment holding company focused on the,mortgage seeks a senior loan originator to work in our,licensed mortgage originator ideally with a license in one of,competitive base salary with commission structure commensurate with experience full,0
incrediblue is busting the myth that boating is only for,incrediblue is busting the myth that boating is only for,experience with serverside mvc frameworks preferably ruby on railsexperience with,benefits includeapple workstationsoftware and tools of your choiceattendance expenses paid,0
vayu builds affordable unmanned aerial vehicles uavs for healthcare supply,vayu is seeking an aerospace mechanical engineer with an entrepreneurial,qualificationsbachelors with years experience or masters in mechanical or aerospace,selected candidate will be offered an excellent base salary commensurate,0
aker solutions is a global provider of products systems and,aker solutions is a global provider of products systems and,qualifications amp personal attributes proficient in microsoft products including word excel,we offer  friendly colleagues in an industry with a bright,1
urlddbfaeecfaccfbffccfbbafacbefbee and aptitude staffing solutions have partnered up in an,responsibilities acquire and maintain a comprehensive expertise in all company,required skills and experienceminimum of five years of experience in,what is offeredour clients core values drive their culture this,1
aker solutions is a global provider of products systems and,corporate overviewaker solutions is a global provider of products systems,qualifications amp personal attributes vocational training as a minimum  to,we offer friendly colleagues in an industry with a bright,1
dice gets fans the best tickets at face value with,dice is the smartest ticketing app on earth and were,you live in londonbrilliant communication skills both written and verbalexperience,youll be working with smart people who have amazing ideas,0
edison international and refined resources have partnered up in an,technician instrument amp controlslocation deweyville txlocation name nrg cottonwood energycategory,job qualificationsability to understand procedures and instructions specific to the,we are a team of almost employees who help power,1
babbel enables anyone to learn languages in an easy and,our company is growing fast we are constantly looking for,years experience in a startup internet environment and know all,responsibility from day one and professional and personal growthpotential within,0
weblinc is the ecommerce platform and services provider for the,weblinc a leading provider of ecommerce technology and services is,ba or bs in accountingintermediate to advanced experience with quickbooks,health amp wellnessmedical planprescription drug plan hradental planvision planflexible spending accountshortterm,0
tidewater finance co was established in for the initial purpose,to apply please visit our website at urlaeedddfcbdecfbaefdfecd and click,the duties for this position include but are not limited,the standard hours for this position are fulltime monday through,0
delivering superior customer services for over years ibex global is,are you ready to start your sales career with a,as a customer service sales representative you should be driven,benefits we offer our employees the following comprehensive benefits plan,0
we have aggressive growth plans in place for the coming,we provide no credit check financing to customers of small,experience and skills  required minimum of years of sales experience,we provide complete online training and office support flexible working,1
why csdcsd is not only a great place to work,the graphic web designer will manage populate and edit the,bachelors degree in graphic design web design visual communication or,csd offers a competitive benefits package for fulltime employees for,0
incrediblue is busting the myth that boating is only for,incrediblue is busting the myth that boating is only for,mastery of html css and javascriptexperience with frontend frameworks like,benefits includeapple workstationsoftware and tools of your choiceattendance expenses paid,0
we place highly qualified governors governesses nannies and private tutors,a vip russian family are seeking an native english nanny,years nannychildcare experiencepossession of a relevant childcare certificate would be,per week negotiableall flights and visas paidaccommodation providedtraveling abroad with,0
unify formerly known as siemens enterprise communications is a premier,develop test plans regression test plans for the functional areas,education experience amp profilebsms in computer science information systems or,competitive remuneration packageprivate insurancework in a challenging multinational environmentcontinuous training,0
united med force was created due to the high demand,are you currently a medical devicepharmaceutical representativeare you currently a,successful medical device pharmaceutical or compounding sales experience strong existing,ancillary product that will compliment your existing call cycle without,0
searching for an apartment is a nightmare were going to,rent rebate is a technology startup in austin that is,friendly no one wants to talk to a sour puss,about rent rebatesearching for an apartment is a nightmare were,0